title,poem_cleaned
,Avunamaz yalanlarla
,dünya var içimde
,Sonu gelmez kalınca
,"işte ordayım, ayrılık yok"
,"işte buradayım, yalan yok"
,dünya var içimde
,Düşünceli gidersin diye
,dünya var içimde
,Hadi durma gelsene
,dünya var içimde
,Sonu gelmez sevince
,
Ah dünya,
,İnsan denli boş esip gürler mi?
,Hakka adalete fıttıran dünya
,Efor sarf eder aklı zorlar mı?
,Tereciye tere sattıran dünya
,nasıl izandır akıl a zarar
,nesil ürettin cani canavar
,Sermayem dediğin elinde var
,Cehaleti halka yutturan dünya
,Gün geçmez cehalet taze can alır
,Namussuz düzende namus kalır
,Olanlar yetime öksüze olur
,Ocaklar söndürüp tüttüren dünya
,İnanç sahibiysen öfke neden
,Yurt kurtarıyorsun nefsi yenmeden
,Deli gömleğiyle halkını güden
,Kardeşi kardeşe dittiren dünya
,Nasihate kalkış hadi lan diyor
,Helal haram demez kul hakkı yiyor
,Kardeş kardeşiyle geçinemiyor
,Yusuf’u kuyuya attıran dünya
,Yüzmek balık sudan bıkar mı?
,Su yokuş yukarı zorla akar mı?
,Kancıktan kalleşten yiğit çıkar mı?
,Deveyi pireye güttüren dünya
,Kancığın kalleşin işi hile
,Bırakmaz yurdumda insanlar güle
,Güle sevdalanmak yasak bülbüle
,Baykuşu yurdumda öttüren dünya
,İman ehli olan günah işler mi?
,Allahsız kitapsız hayat düşler mi?
,Hiç Müslüman Müslüman’ı fişler mi?
,Mazluma acılar tattıran dünya
,Mustafa gariban kime desin
,İndir rahmetini mazlum sevinsin
,Hakkın adaleti neredesin
,Ah Nuh’u tufana tutturan dünya
,
Dünya Handır Ben de Yolcu,
,Dünya Handır Bende Yolcu
,Beşikten mezara
,Dünya yoldur bende yolcu
,Aldığım nefes
,Dünya handır bende yolcu
,Bilgi bilgileri
,İnsanlar gider ileri
,Yurt edinmiş ülkeleri
,Dünya yoldur bende yolcu
,Sınırları tanımazlar
,Yorulup yolda kalmazlar
,Hayat boyu yorulmazlar
,Dünya yoldur bende yolcu
,Sınırsız duvarsız dünya
,Kapısız düşünce buya
,Merhaba der çabaya
,Dünya handır bende yolcu
,Dünden daha iyi yaşar
,Bilgiyle engeller aşar
,Hareket halinde koşar
,Dünya handır bende yolcu
,Yolculuk yapmayı bilen
,Hayatın içine giren
,Baktığını iyi gören
,Dünya handır bende yolcu
,Fakirlikte zenginlikte
,Aradığım derinlikte
,Bilgi bilgelikte
,Dünya handır bende yolcu
,Yardımlaşma dayanışma
,Yolcuysan yolundan şaşma
,İnsanlıktan uzaklaşma
,Dünya handır bende yolcu
,Yolcu yolunu bulmakta
,Ustadır engel aşmakta
,Hep ileriye bakmakta
,Dünya yolcu bende yolcu
,Yolcuların yolu olam
,Denizle deryayı bulam
,Bilgelere umman olam
,Dünya handır bende yolcu
,Ellerimle emeklerim
,Boşa akmaz alın terim
,Baktığım ayna gözlerim
,Dünya handır bende yolcu
,Yalın yaşa derin düşün
,Barış olsun işin gücün
,Seninle yaşar bilincin
,Dünya handır bende yolcu
,Yolcuların yolu yalın
,Dost Şerefi yola salın
,Açık olsun tüm yolların
,Dünya handır bende yolcu
,07.05.2016
,Dost Şeref
,Not
,İki haftalığına Türkiye tatildeyim 26 Mayısta şiir tadın buluşmak dileyimle sevgi saygılarımı sunuyorum
,
Bel bağla.,
,"Dünya geçici handır, sende geçici yolcu"
,Hayatta tutturamazsın normal ölçü
,İnişli çıkışlı yollarla giden yolcu bitirir yolu
,dünya yalan dünya gel buna bel bağla.
,Halil ÇOLAK 11.08.2009
,ANKARA
,
He. Ya. Dün. Devamı,
,"Varmı sana gelip de,"
,Eğlenip kalan Dünya...
,"Sevdiğine sarılıp,"
,Muradın alan Dünya...
,"Boyadın gözümüzü,"
,Herşeyin yalan Dünya...
,"Neyini aldım gittim,"
,senin ulan Dünya...
,
Ahh Dünya,
,"Ah Dünya sende çektim,"
,"İnledikçe gizli gizli gülümsedin,"
,"Nice han, saray yapıldı doymadın,"
,"Yılları, çağları değiştirdin Dünya."
,"Peygamberleri, pirleri inlettin,"
,"Zalimlere, inkarcılara saray idin,"
,"Aksakallı pirleri, mürşitleri yedin,"
,"Aksakallı evliyaları sardın Dünya,"
,"Nice ağalar, paşalar geldi gitti,"
,"Dağların, taşların yol vermedi,"
,"Savaşçılar, isyancılar talan eyledi,"
,İyi kötü demeden sardın Dünya.
,"Peygamberlerin Allah diye gezerdi,"
,"Aç susuz hak mücadele ederdi,"
,"Nuh Nebi gemisi tufanda yüzerdi,"
,Halil-ül Rahmanı sardın Dünya.
,"Ah Dünya bozuk düzene şaştım,"
,"Kötülüğe karşı iyiliği mükafat yaptın,"
,"Hainlik, zalimlik sanki senin tacın,"
,İyileri zindan olup sardın Dünya.
,"Üzerine kat kat şehirler kuruldu,"
,"Senin savaşlar, barışlar yapıldı,"
,"Gökte kuşlara, suda balıklara ev idi,"
,gün Hasan Hüseyin’ i sararsın Dünya.
,"Gelir gider nice devletler, şirketler,"
,"Ahirinde şey aslına döner,"
,"Rabbim, gün olur sana hükmeder,"
,Bütün mahlukatı sararsın Dünya.
,
Yürü be dünya  minnetim yok sana,
,"Bunca derdi sardın benim sırtıma,"
,Yürü be dünya minnetim yok sana.
,"Bundan gayri uymuyorum şartına,"
,Yürü be dünya minnetim yok sana.
,"Girmeyeceğim senin hana,"
,Senin dertlerin yük geliyor cana.
,"Yeter ettiğin yeter inan bana,"
,Yürü be dünya minnetim yok sana.
,"Saçıma ak düştü istersen tanı,"
,Hayatta nasıl unuturum bunu.
,"Dertler artık kocattın beni,"
,Yürü be dünya minnetim yok sana.
,"Sıkışınca yan çizip verme bel,"
,Sakın insana eziyet etme gel.
,"Dünya isen dünyalığını bil,"
,Yürü be dünya minnetim yok sana.
,"Yusuf olarak sözünü tutmam,"
,Senin aklın yere gitmem.
,"Bundan sonra sana eyvallah etmem,"
,Yürü be dünya minnetim yok sana.
,
Ey Dünya!,
,Ey Dünya!
,"Yalansın yalan hayâlim gibi,"
,Bilmem neyine kanayım dünya?
,"Yaşayan ölecek, yetmiş takribi,"
,Daha bâki sanayım dünya?
,"Gençlikte tomurcuk çiçeksin dalda,"
,"Tat dahi kalmıyor zamanla balda,"
,"Dönersin! Taşınır bedenim salda,"
,Niye aldanıp yanayım dünya?
,"İblis'le tebessüm ederek durdun,"
,"Nefsimle birlikte tuzaklar kurdun,"
,"Ölüm vakti geldi, tokadı vurdun,"
,Hangi yanını anayım dünya?
,"Gönlümle keşfettim bendeki beni,"
,"Esmâ-ül Hüsnâ'ya âyine teni,"
,"terketmeden terkettim seni,"
,Hakk yansıtır ayna rânâyım dünya..
,"Mâhiyetin iki kapılı duy han,"
,"Nefsin yemi idi mal, makamla şân,"
,"Adem der habire Hakk'ı Aşkla an,"
,Çün insandan öte mânâyım dünya...
,
Nedensiz,
,"kitap yazsam, İnsan... söz söylesem, İnsan... düş kursam, İnsan... yaparsam yapayım, İnsan..."
,"Evet, hayatı yaşanabilir kılmanın ilk esasıdır insan olmak belki ay insan diyebilmeliyiz insanca cümleler kurmalıyız içinde insanı anlatan. Bütün dünya insan yaratılmıştır fikrinden uzaklaşarak başlamalıyız mesela hayata. Bütün dünya insan yaratılmış olamaz insandan önce dünyada hatta evrende yaşayan milyarlarca varlık vardı. İnsan neden var olan şeyin nedenine merkezine kendini koyar ki?"
,"Sanırım keşifler soru işaretleri başlamış ilk soru kesinlikle Neden? olmalı... Neden, diye başlayan sorular sırrı keşfe yönelmiş mutlaka insanlık. Neden dünya var? Neden insanlar var? Neden hayvanlar var? Neden sınırlar yok? Neden herkes beyaz? Neden insanlar siyah? Neden dağlar yüksek? Neden sular ıslak? Neden şey alırken bedel ödemek zorundayız? Nedenler arayışa girer adrese doğru yönelir."
,"İnsanlar tanımlar yapmaya başlarken şeyler isterler istekleri bildikleri şey üzerine olur. Sanki kendisinde var olan duyguyu tamamlamak esasına göre hareket etmiştir ilk olarak. Mutluluk demektir, nasıl elde edilir, nerede vardır, kim verir, zaman gelir diyerek yapılan çaba sonuca ulaştırmıştır onu... yüzden felsefeciler sorularla yanıtlara ulaşmışlar gerçekliği keşfetmişlerdir. Şimdi burada özlü söz kullanmak gerekebilir yazının genel konusu özlü söz olduğundan buna gerek duymadım"
,Neden? Sorusu başlı başına özlü söz zaten.
,"Neden? soruyu en çocuklar sorar, neden anne? Neden baba? neden ıslak? neden soğuk? neden tatlı? neden sıcak? neden uzak? Güneş neden parlak? Ay neden geceleri çıkar? Neden yemek yemeliyim? Neden uyumalıyım? Neden büyümeliyim? tabi çocukluktan ayrılma dönemlerinde nedenler çıkıyor ortaya, Neden okula gitmeliyim? Öğretmenler gelmedi bugün neden gidip derslere tek girmem gerekiyor? Sıralar neden iki kişilik? Tahta neden siyah? Gökyüzü neden mavi? Tanrı neden gökyüzünde? İnsanlar neden dua ederken ona doğru elini uzatıyor..."
,"Arayışlar dile gelişler insanları bilime, teknolojiye doğru yöneltti gidişte nedensiz değildi... amaç önce neden sorusunu sormak gerekiyordu insanda bunu yaparak deneyimlerini arttırdı dünya üzerinde yeni dünya kurdu. Geldiği noktada şunu gördü, varlığını ören çevreleyen unsuru neden sorusu başlatmış olmasıyla birlikte kaybettiği şey vardı, insan olma halleri... Bunu fark ettiği anda soru daha sordu kendine, Neden? film geri sarılmaya başlandı, şimdi elde avuçta olan değerini yitirmeye başladı, gerçekten istediği neydi? Hani hayat varlık içinde yüzülerek yaşanırdı? Öyleyse mutsuzluk neden? Herşeye sahipken yaşadığı boşluğun anlamı olmalıydı tekrar yola çıktı insanoğlu, elindekilerden özgürleşerek kendini bulma yolculuğuna sefer soru değişiyordu, Neden? Değildi artık soru Kimim? İdi cevap sefer bilimsel verilerle matematiksel formüllerle ifade edilemiyordu. Hatta cevabı hiç kitapta yoktu. Neden sorusu yaratılan dünya anda kimim sorusu ortadan kalkmaya başlıyordu. dönüşüm yolculuğu idi dönüşen ilk defa dünya değil insan oluyordu. Soru basitti cevabı yoktu, Kimim?"
,"Sahi kimsiniz siz? Sordunuz soruyu kendinize, hangi cevapları aldınız gerçekten ait olduğunuz yerde misiniz? Gördüğünüz yaşadığınız aynı şeyler mi? Duygularınızı anlayanlar var etrafınızda? gerçekten sevdiğiniz işi yapıyorsunuz? Mutlu musunuz?"
,"Neden? Kimim? Sorusunu soruyorsunuz farkında mısınız? aydınlanma zamanıdır elde olanlar büyümeden elde olanlardan özgürleşerek cevapları bulmak vaktidir. Soru basit Kimim? Cevapları sizin yolunuza çıkacak işaretlerde gizli işaretlere baktığınızda soracağınız soruda, Neden?"
,
Dıne Derew,
,"Ey cirana ey hevala,............Ey komşular ey arkadaşlar"
,"Dıbem neye ser we bela,....Başınıza bela gelmesin diyorum"
,"Bona dıne pevneçinın,.........Dünya kavga etmeyin,"
,"Dıbem mehışinın dıla,..........Gönülleri incitmeyin diyorum,"
,"Ew ke nizanı bızane,............Bilmeyen varsa bilsin"
,Dıne derew dıne vala...........Dünya yalan dünya boştur.
,
Ben seni dünya ya rezil ederim,
,SENİ DÜNYAYA REZİL EDERİM
,01.04.2012
,İnsanlıktan nasip almayan hayvan
,seni dünya rezil ederim
,Adını sorarsan cingit irfan
,Lan seni dünya rezil ederim
,Yalan dolan kandıran sensin
,İnsanlık bilmeyen vahşi hayvansın
,Senin insan kuldan utansın
,seni dünya rezil ederim
,Çıkarın var yemin edersin
,İnsan değil hayvandan betersin
,Haramları helal yutarsın
,seni dünya rezil ederim
,Yedin üç yediyüz hiç utanmadın
,Kurduğun tuzaktan geri dönmedin
,Erkek söz verdin vermedin
,seni dünya rezil ederim
,Hüseyinim derki olmasın bunlar
,Gezmesin dünya böyle insanlar
,Yediği ekmeği bilir hayvanlar
,seni dünya rezil ederim
,
A A Denemeleri BU ZULÜM DAHA NE KADAR SÜRECEK,
,ZULÜM DAHA SÜRECEK
,"el sürekli dünyayı karıştırıyor. Dünya el yüzünden hiç rahat yüzü görmüyor, göremiyor. Dün neyse gün öyle. Şöyle düşünün dünyanın hiç rahat günü oldu mu? zaman olayla çalkalanıp durdu dünya. Dün el kaide gün Işid belası sardı tüm dünyanın ufuklarını. Dün Esad zulmü gün Sisi zalimiyle kan ağladı durdu dünya."
,"3, 5 senede Filistin’e saldırarak yakıp yıkan İsrail barış zamanlarında adım adım Filistin’i yok ediyor, masum insanların başına evlerini yıkıyor, dünyanın zulme sesi çıkmıyor, hatta zalimler zulmü tasvip ediyor, zalimi mazlum gösteriyor, mazlumu zalim. Çin fırsatta Doğu Türkistan’da zulmünü tekrar ediyor, zavallı Türkmenlere hayatı zindan ediyor."
,"Avrupa’nın hapishane kaçkınları gemilerle Amerika kıtasına çıkınca oradaki çiftliklerin sahibi olan Kızılderililere jenosit uygulamış, koca ırkı yok etme dercesine varmıştır. Yok, edemediklerini dönüştürmüş, zulüm sisteminin parçası haline getirmiştir. Kızılderililerden boşalan toprakları ekip biçmek kölelere ihtiyaç duymuş, köleleri bakir topraklar ola Afrika’dan hayvan avlayarak gemilerle yük taşımış, gayr-i insani şartlarda nakledilen zavallı zencilerin yolculukta çoğunu telef etmiş, cansız bedenlerini okyanusta vahşi balıklara yem yapmıştır."
,"Bakir Afrika daha önce Fransızlar, İngilizler tarafından sömürülmüş, zavallı yerliler hiçbir zaman batılıların zulmünden kurtulamamıştır. Rusya ezel ebed tahakküm ettiği halkalar jenosit uygulamaktan geri durmamış, Stalin’in Sibirya’ya sürdüğü Kırım Ahıska Türklerinin acıları türlü sona erdirilememiştir. Komünist ihtilalin Romanya, Çekoslovakya Polonya’da yaptığı zulümler hep söylenegelmiştir."
,"Hindistan’ın Keşmir’de sürdürdüğü zulüm düzeni, Arakan Müslümanlarına Myanmar’da Budistlerin yaptığı katliam zulümler daha yakın zamana dek sürmekte, masum Müslümanların çığlıkları çaresizliğin ıstırabı böğrümüzü yakmaktadır."
,"Yakın zamanda Amerika’nın başlattığı zulümler en Asya kıtasında Müslüman coğrafyasında olmaktadır. Önce Afganistan, sonra Irak Suriye Arap baharıyla karıştırılan iç isyanlarla boğuşmaya itilen Müslüman halklar…"
,"Bunca zulüm Cahiliye devrinde vardı ancak. Amma Cahiliye eskisini aratmıyor 21. Yüzyılın cehalet zulmü ayyuka çıkmıştır. Dünya zulüm cehalet içinde inim inim inlemekte, kan, gözyaşı masum mazlum halkların çığlığıyla zindana dönmüştür. gün Polonya, Tunus, Yemen, Irak Suriye tam cehenneme dönmüştür. Cehennemin baş zebanisi Amerika’dır. İçinde yananlarsa mazlum dünya milletleridir. Yeni Roma dediğimiz büyük zulüm devletleri dünyayı kana boyamaktadır. Mazlumların gözyaşları sel akmakta, kan oluk oluk akmaktadır. Masum mazlum halkların çığlıkları arşa çıkmaktadır."
,"çığlıklar karşılıksız kalmayacak, zulüm ilelebet payidar olmayacaktır."
,
Çevre...(Beste),
,"çevreni temiz tut, mecbursun buna"
,"nesiller yok oluyor, yazık insana"
,"bundan dünya yok, ders olsun sana"
,benim dostum değildir doğa düşmanı!
,"nesef alamıyorsun, sesin çıkmıyor"
,"pis sularla, atıklarla deniz ölüyor"
,ayağının altından dünyan kayıyor
,benim dostum değildir çevre düşmanı!
,"dünya, dünya, dunya bizim."
,"ekvator'dan kutba (kutup) kadar, dünya bizim"
,eko-sistem sentez'le hayata geldik.
,erezyonu gördükçe ilgilenmedik
,"atmosferi kirletip, ozonu deldik."
,benim dostum olmaz çevre düşmanı!
,
"Dünya, Dünya Fani Dünya",
,"Dünya, dünya fani dünya;"
,Var sana kani dünya?
,fanisin fena;
,Hoş değilsin yani dünya!
,Helak olur fazla seven!
,Akil değil seni öven!
,Kim duymuşsa sana güven;
,Mahvetmişsin onu dünya!
,Düştü çoklar tuzağına!
,Kimler düşmedi ağına?
,Düşmek senin kucağına;
,Herkeslerin sonu dünya!
,Yoktur sende ahde vefa!
,rüyadır onca sefa!
,İmtihandır küllü cefa!
,Arif bilir şunu dünya!
,Evladınsak yakma bizi!
,Viran kılma hanemizi!
,Mahvedersen hepimizi;
,Derler sana cani dünya!
,İğfal etme lütfen halkı!
,Yemesinler artık haltı!
,Meçhul yerin altı;
,ciddidir konu dünya!
,Meşher etmiş Mevla seni!
,Teşhir etmiş deseni
,Alın derken hep hasen’i;
,Ekser duymaz bunu dünya?
,Abdullah Toroslu
,19.01.2012-İzmir
,
Dünya baki değil fanidir fani,
,DÜNYA BAKİ DEĞİL FANİDİR FANİ
,Milyarlarca insan gelmiş buraya...
,Günü gelen gitmiş olsa cani.
,Adınız yazılır gün kuraya...
,Dünya baki değil fanidir fani.
,Çağıracak gün buraya salan!
,Diyecekler gün ölmüştür falan!
,Aklı yetmeyenin dediği yalan...
,Dünya baki değil fanidir fani.
,Ölenler dünyayı rüya sanacak!
,Gerçekleri görüp içten yanacak!
,Nesi var dünyanın bilmem kanacak...
,Dünya baki değil fanidir fani.
,"Kâfire yeşillik, Mü'mine kurak!"
,Alınır altından gün oturak!
,Burası yol üstü geçici durak...
,Dünya baki değil fanidir fani.
,Dünya senin olsa yalnız başına...
,Sahip olursun çakıl taşına.
,Ölüm er geç çıkar bil karşına...
,Dünya baki değil fanidir fani.
,"İnsan olma sakın şirk koşan şopar,"
,Senide alırlar bil apar topar!
,Süre dolar gün kıyamet kopar...
,Dünya baki değil fanidir fani.
,Kulluk bilincini sindir içine...
,Yaşamış olmazsın hiçi hiçine.
,Son evin kazılır toprak içine...
,Dünya baki değil fanidir fani.
,kalıcı sanmayın sahte parkı...
,Dönmez olur gün paslanır çarkı.
,Cenneti görürsen anlarsın farkı...
,Dünya baki değil fanidir fani.
,Ecel oku delinir sine...
,avsın avcıysa pusmuş evsine.
,durum zor gelse nefsine...
,Dünya baki değil fanidir fani.
,Aklı erse der Cumali...
,gazele benzer dünyanın hali.
,Kalandan fazla giden ahali...
,Dünya baki değil fanidir fani.
,
Dünya kandırdın beni...,
,"şey anlamadım,yalan dünyadan,"
,"Çoluk çocuk hepsi, boş yalan,"
,"Var birazcık de,gezip oyalan,"
,"Dünya çok, kandırdın beni."
,"Gençlik nedir nasıl, hiç anlamadım,"
,"Paraya zaman, gönül bağladım,"
,"Ev,araba için,gezdim dolaştım,"
,"Dünya çok, kandırdın beni."
,"Elli yaşa nasıl,hemence geldim,"
,"Çocukluk nasıl da,geçti bilmedim,"
,"Çaresiz dertlere, göğsümü gerdim,"
,"Dünya çok, kandırdın beni."
,"Rızkımın peşinden,hep koştum durdum,"
,"Ekmeğin parası, derdine düştüm,"
,"çabuk yaşa,nasılda geldim,"
,"Dünya çok,kandırdın beni."
,"Nice haklar,nice,geçmiş hukuklar,"
,"Yalan gıybet boşmuş,hep mutluluklar,"
,"İnsanlık arama,hep vefasızlar,"
,"Dünya çok, kandırdın beni,"
,"Şimdi belim kolum,büküldü gün,"
,"Tutmaz oldu dizim,ağrıyor gün,"
,"Ağardı saçlarım,sakal gün be gün,"
,"Dünya çok,kandırdın beni."
,"Yalan dünya yalan,ne var bunda,"
,"Çalış tabii kalma, aç açık burda,"
,"Ahireti sakın,sen hiç unutma,"
,"Dünya çok, kandırdın beni."
,"Keşke hep namazı,güzel kılsaydım,"
,"Kimsenin hakkında,konuşmasaydım,"
,"günah,işlemeseydim,"
,"Dünya çok, kandırdın beni."
,"Dünya kahpe olan, kadın sanki,"
,"Herkesle yatıyor,daha belki,"
,"Kimselere vefa, göstermemişki,"
,"Dünya çok, kandırdın beni."
,"Hüdayi beni dünya,ne aldattı,"
,"Allah cc.dünyaya,değer vermedi,"
,"İnsanlar dünyayı,ne beğendi,"
,"Dünya çok, kandırdın beni."
,30.05.2011//Kırıkkale
,
Biraz Da Ebed İçin...,
,"Hep dünya, dünya deme, bazen olur hepsi pul,"
,ebed hazineyi ara bul...
,
Dünyada benim olsan yeterdi,
,Olmazdı dünya inan umrum
,yalan dünya benim olsaydın
,Eğilmezdi başım akmaz’dı yaşım
,yalan dünya benim olsaydın
,Meskenim olmazdı sokaklar damlar
,Benim halimden kimlerim anlar?
,Dolmazdı gönlüme kederler gamlar
,yalan dünya benim olsaydın
,Solmazdı bahçemde sümbülüm gülüm
,yoksan yanımda tez gelsin ölüm
,Çekilmez hayat anım zulüm
,yalan dünya benim olsaydın
,Boşa koydum dolmaz dolu almadı
,Senden halim soran olmadı
,Sensiz ömrümün tadı kalmadı
,yalan dünya benim olsaydın
,Yâr diyerek mecnun olup gezmezdim
,gün kaderime küsüp kızmadım
,Geceler boyunca şiir yazmazdım
,yalan dünya benim olsaydın
,Hazırım uğrun ölmeye hazır
,Seni gönlüm den ölüm kazır
,Mezarım taşına adını yazdır
,yalan dünya benim olsaydın
,Sensiz dünya’yı neylesin DURAK?
,Yakıyor bağrını sinsi firak
,benden uzakta bense ırak
,yalan dünya benim olsaydın
,Durak YİĞİT
,Gönüllerin Şairi
,2011...KOCAELİ
,
*******************Bu dünya sanada banada yeter,
,Sende bende nefsimizi yıkalım
,dünya sana bana yeter
,Sevgi bayrağını alıp çıkalım
,dünya sana bana yeter
,Kim gelmişte dünya kabul etmemiş
,Hani kim var ömrü dolup gitmemiş
,A dem den yana yenmiş bitmemiş
,dünya sana bana yeter
,Nefis yaptırıyor sahtekarlığı
,Hep bana rep bana kursak darlığı
,Sende bende hakkın kutsal varlığı
,dünya sana bana yeter
,Küsülüler hepsi birden barışsak
,Hep birlikte kardeş kardeş çalışsak
,Adam bölüşmeye alışsak
,dünya sana bana yeter
,Kimi çalar çırpar adam kayırır
,Bölük pürçük insanları ayırır
,Adil olsak hepimizi doyurur
,dünya sana bana yeter
,Sevgiye çağarak cümle alemi
,Yoksulu garibi ağlatma emi
,Barışa imza at al kalemi
,dünya sana bana yeter
,Borani yem kabadayı olma yak
,İnsanlık üstüne korku salma yak
,Kul hakkını sırtımıza almayak
,dünya sana bana yeter
,HALİL ÇİMEN AŞIK BORANİ 10.09.2010
,
Yıkılsın Dünya,
,"Suçsuzlara suçlu gözüyle bakar,"
,"Durduk yere masum yuvalar yıkar,"
,"Saray olsa Cennet olsa çıkar,"
,Eğerki böyleyse yıkılsın dünya.
,"Aslan yuvasında çakal yatıyor,"
,"Zalimler zorbalar cirit atıyor,"
,"Teşkil olan örnek bize yetiyor,"
,Eğerki böyleyse yıkılsın dünya.
,"Söz dinlemez torun torba çocuklar,"
,"Yer bitirir içten içten gıcıklar,"
,"yuvalar yıkar galleş gancıklar,"
,Eğerki böyleyse yıkılsın dünya.
,"Dünya sende hainlerin işi rast gelir,"
,"Hainler yaşar iyi erken ölür,"
,"Yoksul fakir kıymetini kim bilir,"
,Eğerki böyleyse yıkılsın dünya.
,"Kendini Melek zanneder yüzü nursuzlar,"
,"Tilki çakal cirit atar hırsızlar,"
,"Laf dinlemez söz dinlemez arsızlar,"
,Eğerki böyleyse yıkılsın dünya.
,"Tersten bakar insanların ırkına,"
,"Taş koyar garibin hayat çarkına,"
,"Yaşım kırktır çoktan vardım farkına,"
,Eğerki böyleyse yıkılsın dünya.
,"Veysel der göz görer sanmayın kördür,"
,"Zalim dünya zalim zorbaya yârdir,"
,"zaman fakire yoksula dardır,"
,Eğerki böyleyse yıkılsın dünya.
,
Dünya,
,"Dünyanın kapısı herkese açık,"
,"Gelen oldu, kalan olmadı dünya."
,"Kimi üstün zekâ, kimisi kaçık,"
,Hiç kimseye borçlu kalmadı dünya.
,"Dünya rengârenk, Hakkın eseri,"
,"Cezp eder kendine, çeker seri,"
,"Kimi boşboğazdır, kimi serseri,"
,"Yaşayıp ibret almadı, dünya!"
,"Kimi şeytan kurmuş ittifak,"
,"fikri hayali hile, tuzak, fak,"
,"İyilikten uzak, emel nifak,"
,"Güzellikten hisse çalmadı, dünya!"
,"Kimi duygu yüklü, kimisi kibir,"
,"Kimi dünya bekler, kimini kabir,"
,"Kimi Azrail’i zannetmiş Cibir,"
,"Daha var mühletin, dolmadı dünya!"
,"Sarılıp, sevdiğin fani cihandır,"
,"cihana yolcu, cihan handır,"
,"Attığın adım bil imtihandır,"
,gelen yolunu bulmadı dünya!
,"Ders al AHISKALI, çekilsin perde!"
,"İbret almayanlar düşermiş derde,"
,"Ömürleri geçer darda, kederde,"
,"İlim deryasına dalmadı, dünya!"
,
A B Denemeleri Büyük Oyun 3 Dünyada Neler Oluyor,
,BÜYÜK OYUN
,3
,Dünyada Neler Oluyor:
,"Dünyada şey oluyor, hatta şeyler oluyor. Büyük resme bakarsak diyoruz olaylar mevzii değildir. Hemen hatırlayalım; basından öğrendiğimize göre ABD eski Dışişleri Bakanı Kissinger ‘artık Hristiyanlar aramızda savaşmayacağız. İslam dünyasını savaştıracağız. Zaten AB’nin kurulma amacı değil mi?"
,Avrupa 20 yıl 100 yıl savaşları yaptıktan sonra büyük plan yapmıştır. plan dünya sömürüsüne dayanmaktadır. sömürü enternasyonal sömürüdür. Uluslararasıdır. sömürü uluslararası şirketlerin dünyanın yeraltı yer üstü kaynaklarıdır. sömürü düzeni sanayi devriminden sonra kurulmuştur şeye rağmen tıkır tıkır işlemektedir.
,"Sömürü odakları planlarını dünya çapında anlamda planlamıştır. Aynı sömürü kaynakları dünyayı geçen gün yeniden dizayn etmektedir. Aynı sömürü kaynakları savaşları organize temekte, dünya savaşlarını çıkarmakta, ülkeleri bölmekte, parçalamakta, iç karışıklıklar çıkarmakta, anarşi terör odaklarını organize etmekte, onları eylemlere yöneltmektedir. İsyanlar, ihtilaller planlamakta, uygulamaktadır."
,"Devletleri yıkmakta, yeni devletler kurmakta, ülkeleri bölmekte, ülkeleri birleştirmektedir. Demokrasilere müdahale etmekte, yönetimleri düzenlemekte, seçimleri etkilemektedir. Medyayı kontrol etmekte, vasıtasıyla küresel planlarını uygulamakta. Gizli örgütler kurmakta, örgütleri amaçları doğrultusunda kullanmaktadır."
,"Yeni mezhepler tarikatlar kurmakta, mezhep tarikatları kendi amaçları doğrultusunda kullanmaktadır. Böl, parçala, yönet politikasıyla sömürü düzenlerini sağlamlaştırmaktadır."
,"sömürüde petrol devleri başrolü oynadı. Ayrıca dünya çapında sermayeyi kontrol ettiler. sermaye ulusları kontrol ettiği olayları maniple etti. İşte yönlü sömürü düzeni dünya hakimiyetini sağladı. Dünyanın tarafında türlü oyunları planladı. Ordular kurdu, orduları ele geçirdi, olayları kendi palanları çerçevesine maniple etti. Kitleleri kullandı. Ajanlık faaliyetlerine hız verdi. türlü örgüte sızdı onları kendi amaçları çerçevesinde kullandı."
,"Kralları devirdi, seçimle iş başına gelen hükümetleri devirdi. Kendi adamlarını işbaşına getirdi, yönetime gelenleri çeşitli yollardan kullandı."
,
Var Sandık,
,"Şiirlerle yaşadık,şiirlerle yaşlandık,"
,"Dünya yalan bilirdik,aşkı var sandık."
,"Dil daha sükûttayken,tebessüme aldandık,"
,"Dünya yalan bilirdik,aşkı var sandık."
,"Günü gelen Mecnun,düşer Leyla eline,"
,"Kaptırmışız gönlümüz,kaptırmışız yeline,"
,"Taştan,taşa çalınır,beden düşmüş seline,"
,"Dünya yalan bilirdik,aşkı var sandık."
,"Boğazda düğümlenir,sensiz geçmez yemekler,"
,"Serenatlar şiirler,boşa giden emekler,"
,"Kilitleri pas tutmuş gönüller ölüm bekler,"
,"Dünya yalan bilirdik,aşkı var sandık."
,"Nerde nasıl başladı,nasıl bitti bilen yok,"
,"Cenazasiz evde yas,tebessüm var gülen yok,"
,"Gözler kapıya bakar,kapı duvar gelen yok,"
,"Dünya yalan bilirdik,aşkı var sandık."
,
Yalan dünya değil misin?,
,"Kötülere fısat veren,"
,"İyileri aramızdan,"
