title,poem_cleaned
,"İslam karşısında birliğe giden yapı var tam anlamıyla. İslam’ı sapma olarak gören kitabı mukaddes cephesi günden sonra din mensuplarını sapkın, anarşist terörist saydı. Kitaplarını birleştirdi muharref batıl iki din kendilerini yürürlükten kaldıran yeni dine cephe aldılar. Yahudilik başlangıçta İseviliğe baş düşman ilan etmişti. Önce ona açıkça savaş açtı. Sonra onu sinsice tahrif etmeye yöneldi. konu Mevlana’nın Mesnevi’sinde veciz şekilde anlatılıyor. Sonra putperest Roma tarafından dönüştürülerek benimsendi."
,tahrif edilen iki kitabi din onları yürürlükten kaldıran İslam’la karşılaştılar. Baş edemeyeceklerini anladıkları İslam’a karşı birleştiler. Muharref Tevrat İncil’in Kitap-I Mukaddes olarak birleşmesi dayanışmanın eseri. Ayrıca kurnaz Yahudi Hristiyanlığı içinden kuşatan Evangelizm kurarak kendi ideallerine Hristiyan dünyadan gönüllü köleler edindi.
,"Ayrıca dünya hakimiyeti yolunda dünya finans kaynaklarını ele geçirdi. Gerek dünya bankası gerek IMF finansal kuruluşları tesisi etti. Önce Avrupa’yı ele geçirdi, sonra yenidünya Amerika’ya el attı."
,Ardından dünya medyasını avucunun içine aldı. Tam anlamıyla dünya hâkimiyeti elde etti. Siyonizm’in yönlendirdiği lanetli kavim arzu mevut sevdasına düştü. Theodore Hetzel’in sistemleştirdiği düşünce yapısı şimdi dünyayı parmağında oynatıyor.
,"İşte İsrail budur kendine ait düşünce inanç yapısı içinde yaşamakta, eylemlerini buna göre yapmaktadır. Nil’den Fırat’a Büyük İsrail Devleti’ni kurmak eylemi meşru saymakta, günahsız çocuk kadınlara zulm canice katliamlar yapmaktadır. katliamları yapmakta kendine göre haklı gerekçeleri vardır zaman. gerekçelerini dünya kamuoyuna elinde tuttuğu medya inandırmakta, gerçekleri gizleyerek katliamları haklı göstermektedir. Dünyayı uyutarak aldatmakta, geçen gün zulmünü artırmaktadır."
,"Yenidünya düzenini Yahudi tesis etmiştir. BM onun kuklasıdır. Unesco onun kuklasıdır. AB ABD onun emrindedir. Hitler’den sonra tüm Avrupa’yı vicdan azabıyla sarıp sarmalamış, şimdiki zulümlerine alet etmiştir. Arap ülkeleri Arap birliği onun elindedir. İslam dünyası yöneticileri Yahudi dostudurlar yahut ta en azından ondan korkan zavallı ödleklerle yönetilmektedir."
,"Çin, Rusya Uzakdoğu çeşitli saiklarla zalim icraatlara karşı dilsiz kalmaktadır."
,"Lanetlenmiş Yahudi kirli Siyonist planlar geçen gün daha büyük zulümler icat etmekte mahirdir. Gazze’yi dört yandan beton duvarlarla kuşatmıştır. 1.5 milyon insanı açık hava hapishanesine mahkum etmiş, işkenceyle yaşatmakta, yavaş yavaş acı içinde kıvrandırarak öldürmekte, milleti yok etmekte, soykırım yapmaktadır. kendi topraklarında 150 milyon Kızılderili’yi yok eden ABD’nin sicili bozuktur. Onun Amerika’dan mazlumlara sahip çıkmasını beklemek ham hayaldir. İşte aynı zalim Amerika gerçek kara suratını göstermekte mazlum yerine zalime yardım etmektedir."
,halde tek çare sığınacak kapı kalmıştır. Allah’ın kapısıdır. kapıyı çalmak lazım.
,
Yorgunum Yorgun,
,"Geldim dünya sana gün gülmedim,"
,"Yaşıyorum haz almadım,"
,"Yaşayan ölüyüm ölmedim,"
,Zalim dünya sende yorgunum yorgun.
,"Dünya acayip insanlar çeşit,"
,"Nankör hep bana der pay etmez eşit,"
,"Kimse acımaz istersende kafayı üşüt,"
,Zalim dünya sende yorgunum yorgun.
,"Kötüler el üstünde iyiler hordur,"
,"Kahpe dünya sende yaşamak zordur,"
,"Dünya geniş garibe dardır,"
,Zalim dünya sende yorgunum yorgun.
,"Zalim dünya anlayana boş değil,"
,"Ölüm vardır bence iş değil,"
,"Kim nederse desin benim gönlüm hoş değil,"
,Zalim dünya sende yorgunum yorgun.
,"Ağanın patronun keyfi saltanat,"
,"Fakir zorlar mecbur yaşama inat,"
,"Uğraşım boşadır yoktur düzen tat,"
,Zalim dünya sende yorgunum yorgun.
,"Nedense hep sana boyun eğerim,"
,"Bazen sana öfke kusar söğerim,"
,"Veysel derk; sana göre yoktur değrim,"
,Zalim dünya sende yorgunum yorgun.
,
Çanakkale'de Gördüler...,
,"Türk Milleti büyük millet dünya biliyor,"
,"Düşman bizi mertçe yenemiyor, yenemiyor,"
,"Gördüler, Çanakkale geçilmiyor geçilmiyor,"
,Türk Milleti büyük millet dünya biliyor.
,"Bütün dünya oldu bizi yenemedi,"
,"zalimler, bunu defalarca denedi, denedi,"
,"Türk Milleti, dünyada barışın senedi senedi,"
,Türk Milleti büyük millet dünya biliyor.
,
Sevgi Olsaydı...,
,"Dünya sevgi olsaydı böyle olmazdı,"
,"Herkes menzile varır dı yaya kalmazdı,"
,"Seven sevdiğini alır dı haber salmazdı,"
,Dünya sevgi olsaydı böyle olmazdı.
,"Dünya sevgi olsaydı, gül solmaz dı,"
,"Sevgi olsaydı, ayrılık olmazdı olmaz dı,"
,"Sevenler sevdiğini alır alır ağlamaz dı,"
,Dünya sevgi olsaydı böyle olmazdı.
,
Kahpe Dünya Kahpelerin Dünyası,
,"Zalim Dünya alamadım tadını,"
,"Büyüğü küçüğü erkek kadını,"
,"Zamanında koyan koymuş adını,"
,Kahpe Dünya kahpelerin Dünyası.
,"Nedense dışlanırım dobra dilimle,"
,"Cellat zorba tehdit eder ölümle,"
,"Dolmuş dünya fırsatçıyla zalimle,"
,Kahpe Dünya kahpelerin Dünyası.
,"Yüze gülse kin dolu içi,"
,"toplumda herkes değil kaçı,"
,"Doğrunun dürüstün nedirki suçu,"
,Kahpe Dünya kahpelerin Dünyası.
,"şey işler akbabalar lehine,"
,"Geniş Dünya dar geliyor şahine,"
,"Meydan kalmış fırsatçıya haine,"
,Kahpe Dünya kahpelerin Dünyası.
,"Dünya yüzbin kere boşaldı doldu,"
,"Uyanıklar aradı buldu,"
,"İnsanlar acayip fırsatçı oldu,"
,Kahpe Dünya kahpelerin Dünyası.
,"Kıymetin bilmedi nankör adiler,"
,"Gelen giden sana yalan dediler,"
,"Veysel derki Dünyada çoktur adiler,"
,Kahpe Dünya kahpelerin Dünyası.
,Tel:05379590555
,
Adın Ölüm Olsun,
,Adın Ölüm Olsun
,Adın ölüm olsun senin.
,Sonun toprak nasıl olsa.
,Gülün rengin solsun senin.
,Kıştır sonun nasıl olsa.
,"Dünya, dünya yalan dünya."
,Dönme artık yalanla.
,Güzelliğin baş döndürür...
,Sana kanan yanar dünya.
,Gidenin memnun dönmez.
,Gelenin hep ağlar dünya…
,Sonun gelmez durağın yok.
,Ömrü talan eden dünya...
,"Malın, mülkün sihirlidir…"
,Sana tapan çoktur dünya.
,Senin sonun gelecek…
,Adın yalan olsun dünya…
,Şiir türkü sözü: Mehmet Raşit ER
,
Dünya,
,gün göçüp gidersin dünyadan
,Üzerinde biter kuru otlar
,gecenin yağmurun yağdığını
,Bilemezsin
,Gün geçer güneş doğar
,Sual edersin yanına gelenlerden
,Halimiz nice olur sırasını bekleyenlerden
,dost nede halini soran olmaz
,Dünya dünya yalan dünya
,Beni bana bırakmayan dünya
,Allına puluna kandığın dünya
,
Yalan dünyaya mektup,
,"Düşündüm de; Şunca yıldır yaşadığım yalan dünya kahrımı çekmedi. Ondan ayrılmadan önce, yani henüz vakit varken, elim ayağım tutarken, tabii gözüm görüyor, aklım eriyorken veda mektubu yazmalıyım. Tüm insanlar geçip giderken, virgül olsa ona teşekkür babında cümleler bırakmalıyım."
,"Ben, Temmuz ayının 22 sinde akşama ramak kala açmışım gözümü dünyaya. Annemle babam yemek yerken öğle vakti; anneciğim içini çekerek babama:"
,"____Görüyor musun? Ekin biçiyorlar. Kışa hazırlık, erzak edecekler, sıcak umurlarında değil. bizim dördüncü çocuğumuz. Tarla yok, bağ bahçe yok. dar gelirimizle bozkırda; çocuklara nasıl aş, iş, eş bulacağız bilmiyorum."
,_____ Allah kerimdir. Demiş babam.
,"yıllar yılları kovalamış, üstüne üstlük birde hasta olmuş babam. İ şten çıkmış. yapsın annem, kalkıp Samsun’a babasının yanına göçmüş. Tamı tamına beş çocuk hasta adam. Annem rahmetli işe girmiş. Derken babam toparlanmış, vazgeçemediği türlü onamadığı bakkallığına dönmüş."
,"Harıl gürül,var yok derken büyümüşüz işt."
,"Hepimiz okuduk sonunda şükür. benim zor oldu; önden üç kişi okurken dördüncüye yetmiyor. Neyse ki; Benim aklım, zekâm işe yaradı hayatımın yedi yılını yatılı geçirdim. Okuldan okula koştum. Ara mara yok. Doktor olacaktım öğretmen oldum. Bilirsin yalan dünya? Bizim branş ta: Biyoloji, kimya, fizik tabii en insan ruhundan anlamak yatar."
,"bozkırda gözümü açtım ülkemin en yeşil huzurlu şehrinde Rize’de öğretmenliğe başladım. Deniz kıyısında evde oturdum, uçsuz bucaksız Karadeniz seyrimde, yemyeşil çaylıklar gerimde. Denize, yeşile, balığa doydum. Sıcakkanlı, şirin Karadeniz insanını tanıdım. Allah neler nasip ediyor insana. Sonra memleketime geldim annem böbrek hastası idi ya, onla kaldım. Memleketime, doyduğum, yaşadığım, okuduğum kasabama hizmet ettim. Annem gün;"
,"________Bak kızım! hastalık beni yiyip bitirdi, evlen evini ocağını kur, ölürüm, seninde yaşın geçer, işin zorlaşır dedi."
,"Evlendim, telli duvaklı gelin oldum. Erzurum’a gittim. Soğuk, ayaz derken, orayı sevdim. İnsan şeye alışıyor. birazda Polyana’cılık oynadım be yalan dünya. kızım, oğlum oldu. Kızımın adını İrem koydum. bozkırda doğmuşum Kırklareli’nde doğdu, cennet bahçesi olsun hayatı istedim. Oğlum Alper, yüksek olsun, yiğit, mert, çevik zeki olsun diledim. Şükür be yalan dünya iyide oldular. okudular daha rahat yaşadılar. insan hep daha iyiyi ister. Tabii geçmişin yokluğunu bilir, anlarlar."
,"Eee, yalan dünya, yıllar telaşlı sel suyu akıp geçti. şükür öyle ağır hastalık yaşamadım, çocuklarımda, eşimde. Allah bereketini verdi. şey gördüm, güzel şeyler yaşadım. Gözyaşım hep acıya, hasrete değil, sevince süzüldü. eskidin, eskidim. Senin ömrün daha uzun. sana veda edip gideceğim gün."
,"sana teşekkür edip, şükranlarımı sunmadan, helalleşmeden olur mu? tepindim, kahretmedim. Oysa tüm diğerleri çektin beni silkeleyip atmadın, bende şeye rağmen sevdim seni. Bana sunduğun şeyden yararlanmaya çalıştım. Sabrın sağ ol, hakkını helal et. Geldiğim gibi; Buruşuk, kırışık, saçı telsiz, damağı dişsiz, kim bilir aklıselim olmadan geçer giderim. zaman unuturum, düşünemem diye şimdiden veda ettim. Çocuklarıma bana baktığın bak yalan dünya. sevsinler, nede acı çeksinler, mutlu benim hoşnut ömür sürsünler. Seni üzmesinler. Yüce Allah’ı dem anıp şükretsinler. Hoşça kal, hoşça kal yalan dünya."
,Fani kul
,28.7.2009 AKBÜK
,
Dünya,
,Gönlüm akşam hüzün var
,Gözlerimi yollarda bıraktın dünya
,özledim sevgilimi
,Vermedin beni kahrettin dünya
,Boşa geçirdin gençliğimi
,Gözümden yaşları akıttın dünya
,Keşke sana hiç gelmez olsaydım
,Verdiğin sözleri tutmadın dünya
,Beni görsen fark eder
,benim ömrümü tükettin dünya
,Değerin yok artık benim gözüm
,kıyameti hak ettin dünya
,
Bu hayat devam eder,
,"Gönlüm can çekişiyor, sebebi dil yarası"
,Ameliyat olmalı ulaşılmaz orası
,Şunu söyleyeyim gelmiş iken sırası
,Beni infaz ettiler iki celse arası
,"........Bu hayat devam eder, bensiz döner dünya"
,"........Kimine karanlıktır, kimine fener dünya"
,"Yollar çamur olursa, seçemezsin izleri"
,"Yapışır batarsın, geçemezsin düzleri"
,Üzerinde olunca başkasının gözleri
,"Yer etmiyor kafama, híç kimsenin sözleri"
,.......Bu hayat devam eder bensiz döner dünya
,.......Gecesi gündüzü var yanar söner dünya
,Bilmem sayısını arda kalan nefesim
,yalncı dünyada kalmadı hiç hevesim
,Bazen içime doğar dizlerimi dövesim
,"Gelmiyor yüreğimden, hiç kendimi övesim"
,"........ hayat devam eder, bensiz döner dünya"
,........Ondan uzaklaştıkça sırtıma biner dünya
,Elimizde sanki dünyayı terketmek
,ölüm iksirini bulup cana zerketmek
,Fani olduğumuzu güzeldir farketmek
,"Sevmek sevişmek güzel, olmasaydı çarketmek"
,"……. hayat devam eder, bensiz döner dünya"
,"..........Zalime cennet olur, zayıfı yener dünya"
,"Mikdatî dilim yandı, içim yandığı"
,zayıf değilim eller sandığı
,Tahammul ediyorum gönlüm kandığı
,"Kalbim yerinde dönmez, başım döndüğü"
,"....... hayat devam eder, bensiz döner dünya"
,"........Biter fırtınalar, mutlaka diner dünya"
,
Doğruya Doğru Derim.,
,"İstemeden bilmeden geldim dünyaya,"
,"Sevildim büyüdüm ben, piştim oldum nar gibi,"
,"Sevilsem büyüsem’ de, Dünya Dar geldi bana,"
,"Koyun beni toprağa, Dünya Cehennem gibi."
,"Vazgeçtim yaşamaktan, Azrail alsın beni,"
,"Yaşamak bana haram, Dünya yangın yeri."
,"Yorgunuyum dünyanın kim çeker’ki derdimi,"
,"Koyun beni toprağa, Dünya cehennem gibi."
,"Cehennem’ i bilirdim, oysa gerçek Dünya’da,"
,"Cehennem’i buldum, hayatımın sonunda,"
,"Kavruldum ateşinden, Dünya’ nın yolunda,"
,"Koyun beni toprağa, Dünya cehennem gibi."
,"Etrafıma bakındım, pislik sarmış dünyayı,"
,"İstemem pis Dünya’dan, köşkü sarayı,"
,"Mal mülk verseler bana, demem kimseye dayı,"
,"Koyun beni toprağa, Dünya cehennem gibi."
,"dünyada milletin, el emeği göz nuru,"
,"Kıymetsiz mal olmuş, adalet denen mu?"
,"Kara toprak yar oldu, Dünya’ nın yok sonu,"
,"Koyun beni toprağa, dünya cehennem gibi."
,"Değil mi’ haksızlık, hâkim olmuş düzene,"
,"düzen olmuş bombok, dünya dar oldu bize,"
,"dünyada mal mülk var, biri kalsın size,"
,"Koyun beni toprağa, Dünya cehennem gibi."
,"Çılgınlık hâkim olmuş, dili bağlı kulların,"
,"Doğruya doğru derim derler yok senin hakkın,"
,"derim zaman, denmez demen sakın,"
,"Koyun beni toprağa, Dünya cehennem gibi."
,27 Mart 2014
,
Yalan Dünya Yalan Dünya,
,"Baktım dünyanın güzel yapısına, doğasına"
,"Koca koca dağlarına, bitmeyen ovasına"
,"Kendimi bıraktım, kuzeyden güneyden esen havasına"
,"Meğer dünya beni beni taşırmış,"
,Meğer dünya yalanmış..
,"İmrendim yemyeşil ormanına, taşına"
,Düşündüm içindeki çeşit çeşit uçan kuşuna
,Baktım doğanın bulutlardan akan yaşına
,"Meğer dünya beni beni taşırmış,"
,Meğer dünya yalanmış..
,Karlı koca dağları enginlere bakar.
,"Karları erir, nehirleri akar."
,Suları birikir; göl denizler yapar
,"Meğer dünya beni beni taşırmış,"
,Meğer dünya yalanmış..
,"Baktım dünyaya, kendimi küçük gördüm."
,Birkaç yıl içinde oyalandım durdum
,istediğimi hayallerde buldum
,"Meğer dünya beni beni taşırmış,"
,Meğer dünya yalanmış..
,
Bak Dünya Gidiyorum,
,Dünya önce sana geldim
,Bak dünya işte gidiyorum
,Bıraktım şeyimi sana
,Bak dünya işte gidiyorum
,Hayata gelince ağlattın beni
,"Hayatta güldüm, oynattın beni"
,Ölürken düşmana dağlattın beni
,Bak dünya işte gidiyorum
,Hiç tutmadın benim sözümü
,Kendine kul ettin özümü
,Arkada bıraktın gözümü
,Bak dünya işte gidiyorum
,Dostlarımın gitti azı kaldı
,çoğu gitti azı kaldı
,Benim yolumun azı kaldı
,Bak dünya işte gidiyorum
,Sitem etme dünya bana
,"Baba bıraktın, nede Ana"
,"Gitmek için, arıyorum bahane"
,Bak dünya işte gidiyorum
,Ah! Dünya sana kalmaz
,Dağlar yürüdü aklın almaz
,Sular kaynadı asla coşmaz
,Bak dünya işte gidiyorum
,Tahsin derki dünyam naçar
,Diz üstü çöker ellim açar
,Dua ederim Rabbime çar
,Bak dünya işte gidiyorum
,Ankara- 06.06.2011
,
Dünya...,
,"Dünya en güzel şiir ha bire dönüyor,"
,"İçinde hergün binlerce ümit sönüyor,"
,"Dünya dönüyor, seven ölüyor ölüyor,"
,Dünya en güzel şiir ha bire dönüyor...
,
Dünya fani ölüm gerçek,
,"Bırak dünya işlerini,"
,Dünya fani ölüm gerçek.
,"Sabredip sık dişlerini,"
,Dünya fani ölüm gerçek.
,"İstersen etrafına bak,"
,dünyanın çilesi çok.
,"Azrail'den kurtuluş yok,"
,Dünya fani ölüm gerçek.
,"Zengin olsan burada,"
,sakın kalma arada.
,Eski sultanlar nerede?
,Dünya fani ölüm gerçek.
,"Acı ömür dolmaz,"
,dünya kimseye kalmaz.
,"Ölümden kurtuluş olmaz,"
,Dünya fani ölüm gerçek.
,"Yusuf şaşkına dönme,"
,Şeytanın atına binme.
,"Kendine sakın güvenme,"
,Dünya fani ölüm gerçek.
,
Vay Dünya Vay,
,Ömrümü boşa geçirdin
,Genç yaşta yolum şaşırdın
,Çaresiz derde düşürdün
,Bumu adaletin senin
,vay dünya vay vay dünya
,Derdime çare olmadın
,Birkere halden bilmedin
,İyi gün gördürmedin
,Vay dünya vay vay dünya
,Dilek kapısın kapadın
,dediğimi yapmadın
,Yedim feleğin tokatın
,Dayanırmı buna canım
,Vay dünya vay vay dünya
,Hayatta hiç güldürmedin
,Muradıma erdirmedin
,köşeyi döndürmedin
,Vay dünya vay vay dünya
,Derdim hiç bitmiyor benim
,İnsafın yokmudur senin
,Ağlıyor Arif Delen im
,Vay dünya vay vay dünya
,Arif Delen Halk Ozanı
,www.arifdelenmuzikevi.com
,
Emperyal Oyunlar,
,"İkinci Dünya Savaşı sonunda Amerika Rusya arasında bölüşülen Dünya ilginç şeyler yaşamıştır bunun oyundan başak şey olamayacağını düşünmek oldukça yerinde olur. İki kutba suni olarak ayrılan; iki kutubunda el birliği içinde olduğunu göstermemek adına çeşitli senaryolar üretilmiştir. Soğuk savaş, psikolojik savaş, nükleer silahların sınırlandırılması vs...Bu iki emperyal güç tarihte hiç olmadığı insanları salak yerine koymuşlar bunda oldukça başarılı olmuşlardır.Güçlü"
,"Millet olan Türk Milleti oyunlara gelmiş, tarihi birikimini, olması gerekene yerini oyunlar sayesinde terketmiştir. Dünya'da bütün diğer unsurlar şekilde arka bahçe kabul edilmiş olup, iki tarafta arka bahçelerine şirin gözükmek ilginç yötemler uygulamıştır. Öyle ki: yönetemler açık verirken normal karşılanmıştır. Örnek: Amerika sorunlu olan kişi kurumlar, onun zıt kutubunda bulunan Rusya'ya gitmek yerine Avrupa' gittikleri görülmüştür. Bunun tam tersi olmuştur. Türk Milleti olarak Ameriknacı olmuşuz yada Marksit Leninist olarak kendi içimizde birbirimize düşmüşüz. Darbelerin, kargaşaların ardında genel olarak vardır.Sovyet Rusya içinde bulundurduğu Türkleri asimle etmekle uğraşırken, Amerika asimilasyona gizli destek vermiştir. Bizim engellenmesi gereken olduğumuz hususunda anlaşma söz konusudur ki; tarihte neler yaptığımız bellidir. Amerika hikmetse Orta Doğu Türkiye masaya otururken, Türk Milletini bütün olarak almıyor. En ihtiyaç duyduğu dönemde dahi, Türk Milletini bütün olarak düşünüp kendi menfaatlerini koruma cihetine gitmemiştir. korku içine işlemiş ki, Millet güçlenirse beni tarihten silecek diye, Orta Doğu Asya en güçlü en geniş coğrafyaya yayılmış Türklerin Birlik olmasını istemiyor. birlik olamadığımız müddetçe gerek kendi içimizde gerekse Dünya geçerli şeyler yapmamız mümkün değildir.Düşünün, Afganistan' a Türk Askeri istiyor, orada Türk Askeri seviliyor, sebep nedir? Sebep Şudur: Afganistan kuzeyinde özellikle Özbekler, Hazarlar, Kırgızlar,Türkmenler yaşıyor sayıları 10 milyon civarı ülkenin yaklaşık üçte biri. Türk boylarından Talibana El kaideye katılanlar var. Aynı paralelde Tacikistan var. Ülkeninde %35 i Türk boylarından oluşuyor. İran'ın %45 i Türk.(1920 Türkmen soylu kacar hanedanını yıktıklarında oran%60 idi.) İran sorun yaşıyor çözmek Türkiye arabulucu olmaya çalışıyor. Buralardaki Türk Milletini yok sayarak yada asimle etmeye çalışarak durdurmaya çalışmasaydılar, zamanki Dünyanın dengesi bozulmazdı.Tarihte net şekilde bellidir. Türk Milleti denge unsuru olmuştur. Çin içinde 1949 yılında bağımsızlığı elinden alınmış Uygur Cumhuriyetinide 50 milyon Türk'ün asimle edildiğini yada savaşlarda yok edildiğini hesaba katarsanız olayaın vehameti ortaya çıkcaktır. Şimdi daha düşünmeleri gerekecek. Türklerden korkmak yerine Türk Birliğinin kurulması çaba sarfetseler Dünya sorun üretmeyecek kadar. Türkistan sınırları nettirki açıktır ki, bunu değiştirmeye çalışanlar yanlış yaptıklarını bütün berraklığı görürsünüz. Mesela, Rusya sınırları içerisinde Türklerin yaşadığı topraklar 4 milyon km2. Rusya'nın dörtte biridir. Bütün özerk federe Cumhuryetlere Rus doldurmuşlar Cumhuriyet isimleri Türk yerde nüfusun çoğu Rus. Şimdi diyeceksiniz Türkiye neden yapılamadı. Mesela Kürt'lerin yoğun yaşadığı şehirlerde Türkler göç ettikleri yada göç ettirild,ikleri anda problem var. Yani Çin yapınca Rus yapınca iyi bize gelince hikmetse yapılmıyor. facebook'ta 'TÜRKBİRLİĞİ KURULMALIDIR' diye açtığım site bütün oyunları durdurmaya yöneliktir."
,
Dünya Ve İnsan,
,Varsın ayrı olsun bizim rengimiz
,Gam yüklü kervana duraksın dünya.
,Doğumdan ölüme göçer kuşlar
,Gam yüklü kervana duraksın dünya.
,Sırrını aradık çözdük seni
,Gizemli hulya gezdik seni
,şeklin tarihe yazdık seni
,Gam yüklü kervana duraksın dünya.
,küçüksün akıl büyük?
,Bazen dar gelirsin sığmaz uyanık
,"Düzlerin paylandı, dağların oyuk"
,Gam yüklü kervana duraksın dünya.
,Turanoğlu der uzay çağında
,İlim yol çizdik bağında
,Takıldık tuzağa kaldık ağında
,Gam yüklü kervana duraksın dünya.
,
Pakistanlı Çocuk,
,"Pakistan'daki çocuk, sel felaketinin ardından çamurda yatmaktasın. Yorganın rüzgar, rüyaların yaprak olmuş gecenin en ayaz vaktinde. Saçların toprağın ıslak elleriyle yıkanırken, sabunun çamur olmuştur. Sana uzanan eller seni çamura boyamıştır."
,"Gemiler kalkar limandan, içi dışı beyaz tertemiz gemilerdir bunlar. İçindeki yüzler pürüzsüzdür. Bangladeş'te yüzüne kezzap atılmış yüzlere benzer yüzler sıcağın altında kapkara olmuş yüze benzer. yüzler gülüşleriyle martıları kıskandırırlar. yüzler hiç çamura bulaşmamışlardır. Dünya iki yüzlüdür anlayacağın kardeş. yüzü sefalet solurken, öteki yüzü oksijen sağanağı altında berraktır."
,"Otobüsler kalkar terminallerden hiç sana uğramadan Pakistanlı çocuk. ona uzaksın sana uzak. Yollarınız kesişmeden daha, ayrılık yolun başında sizi yerlere savurmaktadır. Dünya yol ayırımlarıyla doludur kardeş. Daha merhaba demeden yollar elvedaya çıkmıştır çoktan. Pakistanlı çocuk! İngiliz çocuktan daha güzelken şeyinle gözlerinle, ellerinle, saçlarınla neden bütün çirkinlikler senin başında? Ey Filistinli, Endonezyalı, Bangladeşli çocuk! Diğer çocuklar oyuncak tabancalarıyla oynarken, neden bütün namlular senin şakağındadır? Ey Pakistanlı çocuk! Yüzün çamura değerken, kendini çamurdan yeniden yaratmaktasın. Yoksa Tanrı'nın çocuğu musun? Hayır, bunun Tanrı alakası yoktur çocuk. Sakın Tanrı'ya haksızlık yapayım deme. insanların kazdığı mezardasın. Küreği ona Tanrı vermemiştir. insanların elleriyle haldesin. Dünya topsa eğer, dünyayı başkaları parmaklarının ucunda oynatmaktadır. yüzden başkalarının oyununda çamura saplanmaktasın."
,"Trenler kalkar garlardan. garda Tolstoy'un son nefesini duymaktasın, garda çocuklar bali çekmektedir ciğerlerine, diğerinde çocuklar özel okullara giderken annelerine el sallamaktadır. Ey Pakistanlı çocuk! Söyle tarafa gitmektesin. Rayların bıçak keskin sırtında, kendine nasıl yol çizmektesin? Unutma Pakistanlı çocuk! Seller evini alıp götürse hiç sahilinde yüzmediğin denizlere, bakışlarını maviye boya. Dertlerin dev dalgalar olsa bile, gözlerin ufuktan ayrılmasın. gün gelecek, umut çiçekleri senin tenekeden saksılarında sapsarı açacak. Dünya sana avuç mutluluk verecek. Yeter Tanrı'ya el açmaktan usanma."
,
Dünya,
,Dünya koskocaman
,Üzerinde küçücük
,Umutlarımsa dünya kadar...
,Dünya döndükçe
,umutlar arkasından
,Dönerim gerçeğe dek.
,Dünya üzerinde
,"Umutlar üzerinde gerçek,"
,Dünya tek
,umutlar dünyası
,İnsanlara denk.
,Dünya döner
,İnsan
,Umutlar dünyasında mihver...
,
Bu Dünya Kimlere Kalmış,
,nasibimizi aldık zaten
,dünya kimlere kalmış
,Umrumda değil olup biten
,dünya kimlere kalmış
,Kuduruyor aldıkça alan alıp
,Doymuyor çaldıkça çalan çalıp
,çekildik gitmiyor gelen gelip
,dünya kimlere kalmış
,tat almamışlar imandan yanı
,Zaten bilmezler yeri yurdu vatanı
,Boşa harcarmışlar Allahın verdiği canı
,dünya kimlere kalmış
,dünya hayrandır
,Bizim dünya kervandır
,Bize zindan onlara ayandır
,dünya kimlere kalmış
,Yerler haramı hiç ölmeyecekmiş
,Umursamazlar sağdaki soldaki kâtibi
,Tanımazlar elli sahife dört kitabı
,dünya kimlere kalmış
,başında taşlar olan kimler acaba
,Onlarda dünya harcamışlar çaba
,Bilmezler gün çekilecek hesaba
,dünya kimlere kalmış
,Kibirden tüy kondurmamış kendi zatına
,türlü günaha göstermişler itina
,Zerre zerre kötülük işlemiş fıtratına
,dünya kimlere kalmış
,Dünyayı saracaklarmış sırtına
,Ahirette götürecek Allah katına
,Gayretleri var bunun ıspatına
,dünya kimlere kalmış
,Bağışıklığımız vardır tür gama
,Açığımız olursa vururuz yama
,Dünyada yaşıyoruz amma
,dünya kimlere kalmış
,12112
,
Biz dünya ya su toprağa can verir,
,dünya su toprağa can verir
,Bizler dünya can verir iken
,dünya su toprağa can verir
,Dünyamız bizlerle renklerinken
,dünya su toprağa can verir
,Özgür ruhlarımızla yaşamak
,yaşta öğrenmeye çalışmak
,Acı tatlı yaşama alışmak
,dünya su toprağa can verir
,Güneşe yol veren akar sular
,Toprağa tohuma can veren sular
,Toprağın nefesi olan buharlar
,dünya su toprağa can verir
,Yağmur ıslatırken güneş kurutur
,Ayrılık kuraklık yokluk avutur
,Neden diyenleri neden uyutur
,dünya su toprağa can verir
,Su toprak neden korunmaz
,İnsanoğlu uğraşmaktan yorulmaz
,Sular olmayınca hayatta olmaz
,dünya su toprağa can verir
,Çorak topraklarda boy veren ekin
,Su toprağın resmini çekin
,İnsanla toprak su rekabet edin
,dünya su toprağa can verir
,İnsan toprak su sırdaş
,Ana maddemizdir toprakla uğraş
,Dost Şeref’im derki gel kendini aş
